{
  "request_id": "msr-ai-report-0123456789abcdef01234567",
  "service": "ai",
  "scope": null,
  "purpose": "moisture_summary_analysis",
  "payload": {
    "schema_version": "1.0",
    "context_hash": "aaaaaaaaaaaaaaaaaaaaaaaaaaaaaaaaaaaaaaaaaaaaaaaaaaaaaaaaaaaaaaaa",
    "question": "请概括本期情况并提出人工复核建议。",
    "current_summary": {
      "content_hash": "bbbbbbbbbbbbbbbbbbbbbbbbbbbbbbbbbbbbbbbbbbbbbbbbbbbbbbbbbbbbbbbb",
      "batch_count": 1,
      "date_range": {
        "start": "2026-07-01",
        "end": "2026-07-01"
      },
      "metrics": {
        "mean_moisture": "0.5000"
      },
      "review_items": []
    },
    "history_summaries": [],
    "experiences": [],
    "rule_snapshot": {
      "version": "default-v2",
      "sha256": "cccccccccccccccccccccccccccccccccccccccccccccccccccccccccccccccc",
      "summary": "当前启用规则的脱敏摘要。"
    },
    "selection_counts": {
      "history": {"total": 0, "sent": 0, "omitted": 0},
      "experiences": {"total": 0, "sent": 0, "omitted": 0},
      "review_items": {"total": 0, "sent": 0, "omitted": 0}
    },
    "instruction": "只基于所给脱敏上下文提供辅助分析，不形成正式质量结论。",
    "response_schema": {}
  },
  "requires_user_consent": true,
  "response_format": "json_object"
}
